number,value,datetime_start,datetime_complete,duration,params_alpha,params_contamination,params_gamma,params_kernel,params_leaf_size,params_max_samples,params_model,params_n_bins,params_n_estimators,params_n_neighbors,params_nu,params_tol,state
0,0.0,2026-04-18 17:12:12.053770,2026-04-18 17:12:12.107484,0 days 00:00:00.053714,,0.0021852986613813824,,,23.0,,LOF,,,21.0,,,COMPLETE
1,0.09090909090909091,2026-04-18 17:12:12.107615,2026-04-18 17:12:12.377104,0 days 00:00:00.269489,,0.12900672532880805,,,,0.5274034664069657,IForest,,350.0,,,,COMPLETE
2,0.0,2026-04-18 17:12:12.377275,2026-04-18 17:12:12.380005,0 days 00:00:00.002730,0.3253338026250708,0.008708668905847936,,,,,HBOS,15.0,,,,0.21159508852163347,COMPLETE
3,0.0,2026-04-18 17:12:12.380115,2026-04-18 17:12:12.382636,0 days 00:00:00.002521,0.3165865559879191,0.0027196209124940936,,,,,HBOS,23.0,,,,0.13716033017599819,COMPLETE
4,0.10050251256281408,2026-04-18 17:12:12.382734,2026-04-18 17:12:12.385222,0 days 00:00:00.002488,0.18707619612801682,0.12627094381908754,,,,,HBOS,34.0,,,,0.1781376912051071,COMPLETE
5,0.0,2026-04-18 17:12:12.385323,2026-04-18 17:12:12.669840,0 days 00:00:00.284517,,0.0011880440954237588,,,,0.5552679889600102,IForest,,373.0,,,,COMPLETE
6,0.0,2026-04-18 17:12:12.670004,2026-04-18 17:12:12.981615,0 days 00:00:00.311611,,0.0025249929209194928,,,,0.8650796940166687,IForest,,391.0,,,,COMPLETE
7,0.0,2026-04-18 17:12:12.981833,2026-04-18 17:12:13.099098,0 days 00:00:00.117265,,0.0015580011008764533,,,,0.4271363733463229,IForest,,158.0,,,,COMPLETE
8,0.0,2026-04-18 17:12:13.099226,2026-04-18 17:12:13.101917,0 days 00:00:00.002691,0.2942132374212118,0.005974860857012641,,,,,HBOS,15.0,,,,0.21273937997981013,COMPLETE
9,0.0,2026-04-18 17:12:13.102025,2026-04-18 17:12:13.213391,0 days 00:00:00.111366,,0.002706596136940912,0.08241925264876443,sigmoid,,,OCSVM,,,,0.2856743641005707,,COMPLETE
10,0.0,2026-04-18 17:12:13.213540,2026-04-18 17:12:13.234045,0 days 00:00:00.020505,,0.10709305396188736,0.00012738199266969165,rbf,,,OCSVM,,,,0.017005131489779723,,COMPLETE
11,0.07719298245614035,2026-04-18 17:12:13.234192,2026-04-18 17:12:13.293996,0 days 00:00:00.059804,,0.13874968155744727,,,77.0,,LOF,,,78.0,,,COMPLETE
12,0.048484848484848485,2026-04-18 17:12:13.294140,2026-04-18 17:12:13.508564,0 days 00:00:00.214424,,0.04303691834216673,,,,0.6774067518529873,IForest,,276.0,,,,COMPLETE
13,0.05673758865248227,2026-04-18 17:12:13.508716,2026-04-18 17:12:13.515500,0 days 00:00:00.006784,0.058083808327474395,0.036771896235456576,,,,,HBOS,38.0,,,,0.8828608028738248,COMPLETE
14,0.0782122905027933,2026-04-18 17:12:13.515617,2026-04-18 17:12:13.756867,0 days 00:00:00.241250,,0.051017847643284056,,,,0.9884981130560856,IForest,,296.0,,,,COMPLETE
15,0.032,2026-04-18 17:12:13.757015,2026-04-18 17:12:13.763842,0 days 00:00:00.006827,0.10210815052932311,0.026320483007575765,,,,,HBOS,39.0,,,,0.5136010781213356,COMPLETE
16,0.08839779005524862,2026-04-18 17:12:13.763955,2026-04-18 17:12:13.820772,0 days 00:00:00.056817,,0.07597170626681614,,,53.0,,LOF,,,59.0,,,COMPLETE
17,0.032,2026-04-18 17:12:13.820914,2026-04-18 17:12:14.153832,0 days 00:00:00.332918,,0.018584698152125233,0.9674803505515404,rbf,,,OCSVM,,,,0.39668058297111974,,COMPLETE
18,0.11214953271028037,2026-04-18 17:12:14.154035,2026-04-18 17:12:14.281063,0 days 00:00:00.127028,,0.07616248418145932,,,,0.40340797752043095,IForest,,169.0,,,,COMPLETE
19,0.08290155440414508,2026-04-18 17:12:14.281217,2026-04-18 17:12:14.288373,0 days 00:00:00.007156,0.46556762025122855,0.07710035533564481,,,,,HBOS,28.0,,,,0.4709056259822392,COMPLETE
20,0.01639344262295082,2026-04-18 17:12:14.288496,2026-04-18 17:12:14.367551,0 days 00:00:00.079055,,0.016497452474811058,,,,0.4065935135462628,IForest,,101.0,,,,COMPLETE
21,0.09090909090909091,2026-04-18 17:12:14.367704,2026-04-18 17:12:14.526993,0 days 00:00:00.159289,,0.1407640706369379,,,,0.5547221866262999,IForest,,204.0,,,,COMPLETE
22,0.11214953271028037,2026-04-18 17:12:14.527155,2026-04-18 17:12:14.781332,0 days 00:00:00.254177,,0.07366005743046813,,,,0.5525970203593042,IForest,,331.0,,,,COMPLETE
23,0.09615384615384616,2026-04-18 17:12:14.781464,2026-04-18 17:12:14.946293,0 days 00:00:00.164829,,0.06746610468039275,,,,0.7042023714582635,IForest,,205.0,,,,COMPLETE
24,0.056338028169014086,2026-04-18 17:12:14.946459,2026-04-18 17:12:15.178389,0 days 00:00:00.231930,,0.028212552389098585,,,,0.4835727802575438,IForest,,310.0,,,,COMPLETE
25,0.0,2026-04-18 17:12:15.178554,2026-04-18 17:12:15.185678,0 days 00:00:00.007124,0.17822488464673092,0.09411489853116632,,,,,HBOS,5.0,,,,0.44224430704604345,COMPLETE
26,0.02877697841726619,2026-04-18 17:12:15.185792,2026-04-18 17:12:15.240699,0 days 00:00:00.054907,,0.05722953354608723,,,24.0,,LOF,,,12.0,,,COMPLETE
27,0.0,2026-04-18 17:12:15.240847,2026-04-18 17:12:15.258422,0 days 00:00:00.017575,,0.032493258065085275,0.000317514622456911,sigmoid,,,OCSVM,,,,0.03325107282749687,,COMPLETE
28,0.104,2026-04-18 17:12:15.258533,2026-04-18 17:12:15.438736,0 days 00:00:00.180203,,0.0915067306154553,,,,0.6574167408100359,IForest,,227.0,,,,COMPLETE
29,0.0,2026-04-18 17:12:15.438889,2026-04-18 17:12:15.615365,0 days 00:00:00.176476,,0.004519285989561096,,,,0.6637689754166662,IForest,,223.0,,,,COMPLETE
