number,value,datetime_start,datetime_complete,duration,params_alpha,params_contamination,params_gamma,params_kernel,params_leaf_size,params_max_samples,params_model,params_n_bins,params_n_estimators,params_n_neighbors,params_nu,params_tol,state
0,0.04613841524573721,2026-04-18 16:51:24.831941,2026-04-18 16:51:29.386536,0 days 00:00:04.554595,,0.0021852986613813824,,,23.0,,LOF,,,21.0,,,COMPLETE
1,0.0836697247706422,2026-04-18 16:51:29.386742,2026-04-18 16:51:30.473440,0 days 00:00:01.086698,,0.12900672532880805,,,,0.5274034664069657,IForest,,350.0,,,,COMPLETE
2,0.011527377521613832,2026-04-18 16:51:30.473633,2026-04-18 16:51:30.479777,0 days 00:00:00.006144,0.3253338026250708,0.008708668905847936,,,,,HBOS,15.0,,,,0.21159508852163347,COMPLETE
3,0.004,2026-04-18 16:51:30.479894,2026-04-18 16:51:30.485688,0 days 00:00:00.005794,0.3165865559879191,0.0027196209124940936,,,,,HBOS,23.0,,,,0.13716033017599819,COMPLETE
4,0.055483311660164715,2026-04-18 16:51:30.485792,2026-04-18 16:51:30.491601,0 days 00:00:00.005809,0.18707619612801682,0.12627094381908754,,,,,HBOS,34.0,,,,0.1781376912051071,COMPLETE
5,0.0,2026-04-18 16:51:30.491709,2026-04-18 16:51:31.623742,0 days 00:00:01.132033,,0.0011880440954237588,,,,0.5552679889600102,IForest,,373.0,,,,COMPLETE
6,0.017964071856287425,2026-04-18 16:51:31.623940,2026-04-18 16:51:32.959142,0 days 00:00:01.335202,,0.0025249929209194928,,,,0.8650796940166687,IForest,,391.0,,,,COMPLETE
7,0.0,2026-04-18 16:51:32.959316,2026-04-18 16:51:33.406937,0 days 00:00:00.447621,,0.0015580011008764533,,,,0.4271363733463229,IForest,,158.0,,,,COMPLETE
8,0.011527377521613832,2026-04-18 16:51:33.407118,2026-04-18 16:51:33.413144,0 days 00:00:00.006026,0.2942132374212118,0.005974860857012641,,,,,HBOS,15.0,,,,0.21273937997981013,COMPLETE
9,0.003992015968063872,2026-04-18 16:51:33.413268,2026-04-18 16:51:44.874540,0 days 00:00:11.461272,,0.002706596136940912,0.08241925264876443,sigmoid,,,OCSVM,,,,0.2856743641005707,,COMPLETE
10,0.013245033112582781,2026-04-18 16:51:44.874729,2026-04-18 16:51:46.251141,0 days 00:00:01.376412,,0.10707142319043285,0.00012738199266969165,rbf,,,OCSVM,,,,0.017005131489779723,,COMPLETE
11,0.09306260575296109,2026-04-18 16:51:46.251353,2026-04-18 16:51:50.643572,0 days 00:00:04.392219,,0.13874968155744727,,,77.0,,LOF,,,78.0,,,COMPLETE
12,0.09484193011647254,2026-04-18 16:51:50.643786,2026-04-18 16:51:55.035259,0 days 00:00:04.391473,,0.04576282638077717,,,76.0,,LOF,,,77.0,,,COMPLETE
13,0.09306260575296109,2026-04-18 16:51:55.035458,2026-04-18 16:51:59.411060,0 days 00:00:04.375602,,0.03818492699186816,,,80.0,,LOF,,,78.0,,,COMPLETE
14,0.09306260575296109,2026-04-18 16:51:59.411256,2026-04-18 16:52:03.767272,0 days 00:00:04.356016,,0.03599603588419231,,,79.0,,LOF,,,78.0,,,COMPLETE
15,0.09921671018276762,2026-04-18 16:52:03.767467,2026-04-18 16:52:08.099868,0 days 00:00:04.332401,,0.04526777712120009,,,62.0,,LOF,,,59.0,,,COMPLETE
16,0.10008936550491511,2026-04-18 16:52:08.100050,2026-04-18 16:52:12.455823,0 days 00:00:04.355773,,0.03363343006228371,,,56.0,,LOF,,,53.0,,,COMPLETE
17,0.09918845807033363,2026-04-18 16:52:12.455998,2026-04-18 16:52:16.749169,0 days 00:00:04.293171,,0.019078644159923778,,,53.0,,LOF,,,47.0,,,COMPLETE
18,0.09918845807033363,2026-04-18 16:52:16.749361,2026-04-18 16:52:21.088406,0 days 00:00:04.339045,,0.019744534890275105,,,55.0,,LOF,,,49.0,,,COMPLETE
19,0.09668755595344673,2026-04-18 16:52:21.088618,2026-04-18 16:52:25.436034,0 days 00:00:04.347416,,0.06542183122944857,,,62.0,,LOF,,,57.0,,,COMPLETE
20,0.02761982128350934,2026-04-18 16:52:25.436225,2026-04-18 16:52:29.079225,0 days 00:00:03.643000,,0.016443592743930778,0.7937580731016354,sigmoid,,,OCSVM,,,,0.08080797119846915,,COMPLETE
21,0.10008936550491511,2026-04-18 16:52:29.079438,2026-04-18 16:52:33.681618,0 days 00:00:04.602180,,0.023721151174414958,,,41.0,,LOF,,,55.0,,,COMPLETE
22,0.09921671018276762,2026-04-18 16:52:33.681820,2026-04-18 16:52:38.373299,0 days 00:00:04.691479,,0.028286394733453582,,,40.0,,LOF,,,61.0,,,COMPLETE
23,0.09809264305177112,2026-04-18 16:52:38.373518,2026-04-18 16:52:42.974402,0 days 00:00:04.600884,,0.06714174062118426,,,40.0,,LOF,,,31.0,,,COMPLETE
24,0.09565987599645705,2026-04-18 16:52:42.974589,2026-04-18 16:52:47.301107,0 days 00:00:04.326518,,0.009502763123538647,,,64.0,,LOF,,,61.0,,,COMPLETE
25,0.09567617295308188,2026-04-18 16:52:47.301309,2026-04-18 16:52:51.936145,0 days 00:00:04.634836,,0.05550863778438973,,,40.0,,LOF,,,35.0,,,COMPLETE
26,0.10008936550491511,2026-04-18 16:52:51.936347,2026-04-18 16:52:56.337601,0 days 00:00:04.401254,,0.025164100222475016,,,64.0,,LOF,,,55.0,,,COMPLETE
27,0.09403254972875226,2026-04-18 16:52:56.337799,2026-04-18 16:53:00.655274,0 days 00:00:04.317475,,0.025690125294830123,,,46.0,,LOF,,,40.0,,,COMPLETE
28,0.0253592561284869,2026-04-18 16:53:00.655461,2026-04-18 16:53:31.457553,0 days 00:00:30.802092,,0.012957197058481409,0.000487964369362564,rbf,,,OCSVM,,,,0.3865720521599313,,COMPLETE
29,0.0863849765258216,2026-04-18 16:53:31.457747,2026-04-18 16:53:36.097471,0 days 00:00:04.639724,,0.005652125136362192,,,24.0,,LOF,,,52.0,,,COMPLETE
