number,value,datetime_start,datetime_complete,duration,params_alpha,params_contamination,params_gamma,params_kernel,params_leaf_size,params_max_samples,params_model,params_n_bins,params_n_estimators,params_n_neighbors,params_nu,params_tol,state
0,0.04081632653061224,2026-04-18 17:08:28.090324,2026-04-18 17:08:28.153420,0 days 00:00:00.063096,,0.0021852986613813824,,,23.0,,LOF,,,21.0,,,COMPLETE
1,0.22349570200573066,2026-04-18 17:08:28.153577,2026-04-18 17:08:28.578940,0 days 00:00:00.425363,,0.12900672532880805,,,,0.5274034664069657,IForest,,350.0,,,,COMPLETE
2,0.08547008547008547,2026-04-18 17:08:28.579119,2026-04-18 17:08:28.584444,0 days 00:00:00.005325,0.3253338026250708,0.008708668905847936,,,,,HBOS,15.0,,,,0.21159508852163347,COMPLETE
3,0.039603960396039604,2026-04-18 17:08:28.584568,2026-04-18 17:08:28.589693,0 days 00:00:00.005125,0.3165865559879191,0.0027196209124940936,,,,,HBOS,23.0,,,,0.13716033017599819,COMPLETE
4,0.1529051987767584,2026-04-18 17:08:28.589795,2026-04-18 17:08:28.594965,0 days 00:00:00.005170,0.18707619612801682,0.12627094381908754,,,,,HBOS,34.0,,,,0.1781376912051071,COMPLETE
5,0.0,2026-04-18 17:08:28.595070,2026-04-18 17:08:29.058815,0 days 00:00:00.463745,,0.0011880440954237588,,,,0.5552679889600102,IForest,,373.0,,,,COMPLETE
6,0.0,2026-04-18 17:08:29.058989,2026-04-18 17:08:29.581256,0 days 00:00:00.522267,,0.0025249929209194928,,,,0.8650796940166687,IForest,,391.0,,,,COMPLETE
7,0.0,2026-04-18 17:08:29.581444,2026-04-18 17:08:29.760734,0 days 00:00:00.179290,,0.0015580011008764533,,,,0.4271363733463229,IForest,,158.0,,,,COMPLETE
8,0.07017543859649122,2026-04-18 17:08:29.760912,2026-04-18 17:08:29.766069,0 days 00:00:00.005157,0.2942132374212118,0.005974860857012641,,,,,HBOS,15.0,,,,0.21273937997981013,COMPLETE
9,0.019801980198019802,2026-04-18 17:08:29.766185,2026-04-18 17:08:29.971942,0 days 00:00:00.205757,,0.002706596136940912,0.08241925264876443,sigmoid,,,OCSVM,,,,0.2856743641005707,,COMPLETE
10,0.21621621621621623,2026-04-18 17:08:29.972117,2026-04-18 17:08:29.998206,0 days 00:00:00.026089,,0.10707142319043285,0.00012738199266969165,rbf,,,OCSVM,,,,0.017005131489779723,,COMPLETE
11,0.18857142857142858,2026-04-18 17:08:29.998345,2026-04-18 17:08:30.031800,0 days 00:00:00.033455,,0.13412923922791903,0.00011200687440843911,rbf,,,OCSVM,,,,0.02340327681311205,,COMPLETE
12,0.29508196721311475,2026-04-18 17:08:30.031932,2026-04-18 17:08:30.072387,0 days 00:00:00.040455,,0.0423056096675609,0.00013294479860745514,rbf,,,OCSVM,,,,0.03024872991916231,,COMPLETE
13,0.3717948717948718,2026-04-18 17:08:30.072526,2026-04-18 17:08:30.211075,0 days 00:00:00.138549,,0.03941807350988234,,,74.0,,LOF,,,80.0,,,COMPLETE
14,0.3717948717948718,2026-04-18 17:08:30.211247,2026-04-18 17:08:30.352292,0 days 00:00:00.141045,,0.03706082437104764,,,80.0,,LOF,,,80.0,,,COMPLETE
15,0.4233576642335766,2026-04-18 17:08:30.352460,2026-04-18 17:08:30.493541,0 days 00:00:00.141081,,0.02321711897892211,,,80.0,,LOF,,,80.0,,,COMPLETE
16,0.4172661870503597,2026-04-18 17:08:30.493709,2026-04-18 17:08:30.634301,0 days 00:00:00.140592,,0.026101760401462667,,,80.0,,LOF,,,80.0,,,COMPLETE
17,0.4375,2026-04-18 17:08:30.634474,2026-04-18 17:08:30.747102,0 days 00:00:00.112628,,0.019304194565546974,,,62.0,,LOF,,,60.0,,,COMPLETE
18,0.4375,2026-04-18 17:08:30.747295,2026-04-18 17:08:30.846802,0 days 00:00:00.099507,,0.017439930911841362,,,58.0,,LOF,,,49.0,,,COMPLETE
19,0.3275862068965517,2026-04-18 17:08:30.846984,2026-04-18 17:08:30.944132,0 days 00:00:00.097148,,0.013876147009635013,,,54.0,,LOF,,,47.0,,,COMPLETE
20,0.1346153846153846,2026-04-18 17:08:30.944291,2026-04-18 17:08:31.042916,0 days 00:00:00.098625,,0.005766882078185946,,,55.0,,LOF,,,48.0,,,COMPLETE
21,0.4375,2026-04-18 17:08:31.043082,2026-04-18 17:08:31.154107,0 days 00:00:00.111025,,0.01830854984043564,,,63.0,,LOF,,,60.0,,,COMPLETE
22,0.2982456140350877,2026-04-18 17:08:31.154273,2026-04-18 17:08:31.262712,0 days 00:00:00.108439,,0.011995361950043621,,,63.0,,LOF,,,59.0,,,COMPLETE
23,0.29245283018867924,2026-04-18 17:08:31.262871,2026-04-18 17:08:31.373461,0 days 00:00:00.110590,,0.06712960101398252,,,64.0,,LOF,,,60.0,,,COMPLETE
24,0.4375,2026-04-18 17:08:31.373609,2026-04-18 17:08:31.488208,0 days 00:00:00.114599,,0.01812092714071663,,,41.0,,LOF,,,61.0,,,COMPLETE
25,0.21621621621621623,2026-04-18 17:08:31.488392,2026-04-18 17:08:31.568006,0 days 00:00:00.079614,,0.008217396783740694,,,65.0,,LOF,,,31.0,,,COMPLETE
26,0.4375,2026-04-18 17:08:31.568164,2026-04-18 17:08:31.685558,0 days 00:00:00.117394,,0.017263670554118503,,,46.0,,LOF,,,65.0,,,COMPLETE
27,0.3163265306122449,2026-04-18 17:08:31.685718,2026-04-18 17:08:31.774486,0 days 00:00:00.088768,,0.06806194768289775,,,60.0,,LOF,,,39.0,,,COMPLETE
28,0.4,2026-04-18 17:08:31.774652,2026-04-18 17:08:31.886746,0 days 00:00:00.112094,,0.028128347789802673,,,70.0,,LOF,,,52.0,,,COMPLETE
29,0.11764705882352941,2026-04-18 17:08:31.886925,2026-04-18 17:08:32.008731,0 days 00:00:00.121806,,0.004190232082710552,,,46.0,,LOF,,,68.0,,,COMPLETE
