number,value,datetime_start,datetime_complete,duration,params_alpha,params_contamination,params_leaf_size,params_max_samples,params_model,params_n_bins,params_n_estimators,params_n_neighbors,params_tol,state
0,0.08379888268156424,2026-06-07 12:23:20.421829,2026-06-07 12:23:20.436396,0 days 00:00:00.014567,,0.002285325525633921,71.0,,LOF,,,10.0,,COMPLETE
1,0.10810810810810811,2026-06-07 12:23:20.436465,2026-06-07 12:23:20.581540,0 days 00:00:00.145075,,0.0030803400529839683,,,COPOD,,,,,COMPLETE
2,0.10695187165775401,2026-06-07 12:23:20.581602,2026-06-07 12:23:20.589947,0 days 00:00:00.008345,,0.004678719265016202,,,COPOD,,,,,COMPLETE
3,0.6730769230769231,2026-06-07 12:23:20.589992,2026-06-07 12:23:20.703637,0 days 00:00:00.113645,,0.06407866261851013,,0.6599641068895281,IForest,,80.0,,,COMPLETE
4,0.24271844660194175,2026-06-07 12:23:20.703723,2026-06-07 12:23:21.508449,0 days 00:00:00.804726,0.40611470057706595,0.15255065745117377,,,HBOS,49.0,,,0.30892170379736505,COMPLETE
5,0.0,2026-06-07 12:23:21.508515,2026-06-07 12:23:21.562629,0 days 00:00:00.054114,,0.0011998556988857205,28.0,,LOF,,,92.0,,COMPLETE
6,0.3626943005181347,2026-06-07 12:23:21.562689,2026-06-07 12:23:21.779406,0 days 00:00:00.216717,,0.17023282716867383,,0.9576492590949324,IForest,,167.0,,,COMPLETE
7,0.1111111111111111,2026-06-07 12:23:21.779474,2026-06-07 12:23:21.783761,0 days 00:00:00.004287,0.2004518719478462,0.0012707770074499693,,,HBOS,19.0,,,0.28064667700781154,COMPLETE
8,0.6104651162790697,2026-06-07 12:23:21.783810,2026-06-07 12:23:21.868422,0 days 00:00:00.084612,,0.07012604000905368,,0.990820855620362,IForest,,61.0,,,COMPLETE
9,0.3148148148148148,2026-06-07 12:23:21.868483,2026-06-07 12:23:21.876573,0 days 00:00:00.008090,,0.04758470274910409,,,COPOD,,,,,COMPLETE
10,0.2669902912621359,2026-06-07 12:23:21.876613,2026-06-07 12:23:21.886283,0 days 00:00:00.009670,,0.018054373833527988,,,ECOD,,,,,COMPLETE
11,0.7954545454545454,2026-06-07 12:23:21.886326,2026-06-07 12:23:21.965958,0 days 00:00:00.079632,,0.045706913124722665,,0.38737137356600115,IForest,,52.0,,,COMPLETE
12,0.8913043478260869,2026-06-07 12:23:21.966021,2026-06-07 12:23:22.039102,0 days 00:00:00.073081,,0.026097789726971476,,0.31843113004974644,IForest,,55.0,,,COMPLETE
13,0.6796116504854369,2026-06-07 12:23:22.039164,2026-06-07 12:23:22.109483,0 days 00:00:00.070319,,0.014632859991184757,,0.3206955132533633,IForest,,51.0,,,COMPLETE
14,0.8836206896551724,2026-06-07 12:23:22.109549,2026-06-07 12:23:22.249096,0 days 00:00:00.139547,,0.026641960893341532,,0.30312715801209456,IForest,,109.0,,,COMPLETE
15,0.20833333333333334,2026-06-07 12:23:22.249154,2026-06-07 12:23:22.258590,0 days 00:00:00.009436,,0.007795893358622733,,,ECOD,,,,,COMPLETE
16,0.8874458874458875,2026-06-07 12:23:22.258639,2026-06-07 12:23:22.410551,0 days 00:00:00.151912,,0.02690461565877372,,0.49213948129773666,IForest,,120.0,,,COMPLETE
17,0.5303030303030303,2026-06-07 12:23:22.410617,2026-06-07 12:23:22.598625,0 days 00:00:00.188008,,0.008775264978803187,,0.5399595017864214,IForest,,148.0,,,COMPLETE
18,0.9251101321585903,2026-06-07 12:23:22.598686,2026-06-07 12:23:22.852325,0 days 00:00:00.253639,,0.024350525503093797,,0.5163214193051527,IForest,,200.0,,,COMPLETE
19,0.4639175257731959,2026-06-07 12:23:22.852399,2026-06-07 12:23:22.884923,0 days 00:00:00.032524,,0.008316631246594855,14.0,,LOF,,,44.0,,COMPLETE
20,0.35564853556485354,2026-06-07 12:23:22.884986,2026-06-07 12:23:22.894089,0 days 00:00:00.009103,,0.034039297078737034,,,ECOD,,,,,COMPLETE
21,0.9070796460176991,2026-06-07 12:23:22.894132,2026-06-07 12:23:23.144379,0 days 00:00:00.250247,,0.022056860459766084,,0.510162654625356,IForest,,200.0,,,COMPLETE
22,0.5426356589147286,2026-06-07 12:23:23.144453,2026-06-07 12:23:23.384508,0 days 00:00:00.240055,,0.09583114407256893,,0.6449739387715583,IForest,,194.0,,,COMPLETE
23,0.9049773755656109,2026-06-07 12:23:23.384574,2026-06-07 12:23:23.627044,0 days 00:00:00.242470,,0.020579459219353228,,0.4842943809375478,IForest,,191.0,,,COMPLETE
24,0.7981220657276995,2026-06-07 12:23:23.627110,2026-06-07 12:23:23.882006,0 days 00:00:00.254896,,0.01700347184394009,,0.5192427993666683,IForest,,200.0,,,COMPLETE
25,0.21739130434782608,2026-06-07 12:23:23.882076,2026-06-07 12:23:23.890676,0 days 00:00:00.008600,0.01417034028739772,0.012016544974119895,,,HBOS,5.0,,,0.8330312987117048,COMPLETE
26,0.3439153439153439,2026-06-07 12:23:23.890731,2026-06-07 12:23:24.109778,0 days 00:00:00.219047,,0.005186873711674039,,0.6386583199305951,IForest,,174.0,,,COMPLETE
27,0.572139303482587,2026-06-07 12:23:24.109847,2026-06-07 12:23:24.343675,0 days 00:00:00.233828,,0.011658983721132924,,0.4542657369208627,IForest,,180.0,,,COMPLETE
28,0.9009009009009009,2026-06-07 12:23:24.343744,2026-06-07 12:23:24.539201,0 days 00:00:00.195457,,0.021546614070519863,,0.5569442287458026,IForest,,151.0,,,COMPLETE
29,0.8366533864541833,2026-06-07 12:23:24.539269,2026-06-07 12:23:24.601145,0 days 00:00:00.061876,,0.03601162817971516,77.0,,LOF,,,97.0,,COMPLETE
