number,value,datetime_start,datetime_complete,duration,params_alpha,params_contamination,params_gamma,params_kernel,params_leaf_size,params_max_samples,params_model,params_n_bins,params_n_estimators,params_n_neighbors,params_nu,params_tol,state
0,0.0,2026-04-18 17:10:22.970978,2026-04-18 17:10:22.979237,0 days 00:00:00.008259,,0.0021852986613813824,,,23.0,,LOF,,,21.0,,,COMPLETE
1,0.08651399491094147,2026-04-18 17:10:22.979353,2026-04-18 17:10:23.441450,0 days 00:00:00.462097,,0.12900672532880805,,,,0.5274034664069657,IForest,,350.0,,,,COMPLETE
2,0.0,2026-04-18 17:10:23.441629,2026-04-18 17:10:23.444503,0 days 00:00:00.002874,0.3253338026250708,0.008708668905847936,,,,,HBOS,15.0,,,,0.21159508852163347,COMPLETE
3,0.0,2026-04-18 17:10:23.444614,2026-04-18 17:10:23.447313,0 days 00:00:00.002699,0.3165865559879191,0.0027196209124940936,,,,,HBOS,23.0,,,,0.13716033017599819,COMPLETE
4,0.10951008645533142,2026-04-18 17:10:23.447420,2026-04-18 17:10:23.450099,0 days 00:00:00.002679,0.18707619612801682,0.12627094381908754,,,,,HBOS,34.0,,,,0.1781376912051071,COMPLETE
5,0.0,2026-04-18 17:10:23.450210,2026-04-18 17:10:23.949922,0 days 00:00:00.499712,,0.0011880440954237588,,,,0.5552679889600102,IForest,,373.0,,,,COMPLETE
6,0.0,2026-04-18 17:10:23.950088,2026-04-18 17:10:24.520126,0 days 00:00:00.570038,,0.0025249929209194928,,,,0.8650796940166687,IForest,,391.0,,,,COMPLETE
7,0.0,2026-04-18 17:10:24.520301,2026-04-18 17:10:24.717661,0 days 00:00:00.197360,,0.0015580011008764533,,,,0.4271363733463229,IForest,,158.0,,,,COMPLETE
8,0.0,2026-04-18 17:10:24.717809,2026-04-18 17:10:24.720664,0 days 00:00:00.002855,0.2942132374212118,0.005974860857012641,,,,,HBOS,15.0,,,,0.21273937997981013,COMPLETE
9,0.0,2026-04-18 17:10:24.720784,2026-04-18 17:10:24.902748,0 days 00:00:00.181964,,0.002706596136940912,0.08241925264876443,sigmoid,,,OCSVM,,,,0.2856743641005707,,COMPLETE
10,0.08934707903780069,2026-04-18 17:10:24.902908,2026-04-18 17:10:24.924544,0 days 00:00:00.021636,,0.10709305396188736,0.00012738199266969165,rbf,,,OCSVM,,,,0.017005131489779723,,COMPLETE
11,0.08982035928143713,2026-04-18 17:10:24.924665,2026-04-18 17:10:24.951772,0 days 00:00:00.027107,,0.13412932717826181,0.00011200687440843911,rbf,,,OCSVM,,,,0.02340327681311205,,COMPLETE
12,0.08791208791208792,2026-04-18 17:10:24.951886,2026-04-18 17:10:24.985068,0 days 00:00:00.033182,,0.0423056096675609,0.00013299972137426806,rbf,,,OCSVM,,,,0.030206900966364095,,COMPLETE
13,0.013157894736842105,2026-04-18 17:10:24.985202,2026-04-18 17:10:25.009752,0 days 00:00:00.024550,,0.03171498570317026,,,74.0,,LOF,,,80.0,,,COMPLETE
14,0.0784313725490196,2026-04-18 17:10:25.009956,2026-04-18 17:10:25.017482,0 days 00:00:00.007526,0.07463175855752485,0.05276057205431371,,,,,HBOS,40.0,,,,0.7974566319170611,COMPLETE
15,0.046511627906976744,2026-04-18 17:10:25.017616,2026-04-18 17:10:25.150620,0 days 00:00:00.133004,,0.021163782797653838,0.0017682049862787483,rbf,,,OCSVM,,,,0.14369172242386336,,COMPLETE
16,0.07692307692307693,2026-04-18 17:10:25.150779,2026-04-18 17:10:25.261005,0 days 00:00:00.110226,,0.0757806875959187,0.7885200212331843,sigmoid,,,OCSVM,,,,0.16389127043524593,,COMPLETE
17,0.11764705882352941,2026-04-18 17:10:25.261184,2026-04-18 17:10:25.268435,0 days 00:00:00.007251,0.09859839400160426,0.1491660212716666,,,,,HBOS,36.0,,,,0.5217044804522301,COMPLETE
18,0.046875,2026-04-18 17:10:25.268553,2026-04-18 17:10:25.276007,0 days 00:00:00.007454,0.11413134414083469,0.017716447216200432,,,,,HBOS,37.0,,,,0.5360354498418215,COMPLETE
19,0.0851063829787234,2026-04-18 17:10:25.276159,2026-04-18 17:10:25.283424,0 days 00:00:00.007265,0.1710552893264893,0.06852735468627309,,,,,HBOS,31.0,,,,0.49777931038074774,COMPLETE
20,0.046875,2026-04-18 17:10:25.283535,2026-04-18 17:10:25.290826,0 days 00:00:00.007291,0.4797914653744445,0.02946009022210369,,,,,HBOS,30.0,,,,0.47355665147517845,COMPLETE
21,0.08403361344537816,2026-04-18 17:10:25.290937,2026-04-18 17:10:25.298246,0 days 00:00:00.007309,0.18934950987529758,0.10805932103037641,,,,,HBOS,31.0,,,,0.6771759930923583,COMPLETE
22,0.09289617486338798,2026-04-18 17:10:25.298351,2026-04-18 17:10:25.317669,0 days 00:00:00.019318,,0.14691016593448328,,,41.0,,LOF,,,65.0,,,COMPLETE
23,0.07659574468085106,2026-04-18 17:10:25.317794,2026-04-18 17:10:25.336734,0 days 00:00:00.018940,,0.07844512930221338,,,40.0,,LOF,,,65.0,,,COMPLETE
24,0.11886304909560723,2026-04-18 17:10:25.336866,2026-04-18 17:10:25.352853,0 days 00:00:00.015987,,0.14946775026576495,,,54.0,,LOF,,,45.0,,,COMPLETE
25,0.0962566844919786,2026-04-18 17:10:25.352966,2026-04-18 17:10:25.368991,0 days 00:00:00.016025,,0.05037477542333996,,,69.0,,LOF,,,33.0,,,COMPLETE
26,0.11406844106463879,2026-04-18 17:10:25.369101,2026-04-18 17:10:25.385037,0 days 00:00:00.015936,,0.08426396718299972,,,59.0,,LOF,,,45.0,,,COMPLETE
27,0.12213740458015267,2026-04-18 17:10:25.385146,2026-04-18 17:10:25.401229,0 days 00:00:00.016083,,0.08205191695456916,,,57.0,,LOF,,,47.0,,,COMPLETE
28,0.10909090909090909,2026-04-18 17:10:25.401353,2026-04-18 17:10:25.417859,0 days 00:00:00.016506,,0.05746897446436876,,,56.0,,LOF,,,47.0,,,COMPLETE
29,0.10126582278481013,2026-04-18 17:10:25.417978,2026-04-18 17:10:25.434139,0 days 00:00:00.016161,,0.030828823854220654,,,47.0,,LOF,,,46.0,,,COMPLETE
